
// ARQUIVO GERADO AUTOMATICAMENTE VIA PYTHON
const memorias = [
    {
        "date": "2020-12-21",
        "displayDate": "Dezembro, 2020",
        "image": "./src/img/memorias/2020-12-21_Primeira-foto-do-casal-antes-de-ser-casal-vai-sem-filtro-mesmo.jpg",
        "caption": "Primeira foto do casal antes de ser casal vai sem filtro mesmo",
        "hiddenCaption": "Eu lembro desse dia... Primeira foto do casal antes de ser casal vai sem filtro mesmo"
    },
    {
        "date": "2020-12-21",
        "displayDate": "Dezembro, 2020",
        "image": "./src/img/memorias/2020-12-21_Primeira-foto-do-casal-antes-de-ser-casal².jpg",
        "caption": "Primeira foto do casal antes de ser casal²",
        "hiddenCaption": "Eu lembro desse dia... Primeira foto do casal antes de ser casal²"
    },
    {
        "date": "2021-02-06",
        "displayDate": "Fevereiro, 2021",
        "image": "./src/img/memorias/2021-02-06_Nossa-primeira-foto-juntos-S2.jpg",
        "caption": "Nossa primeira foto juntos S2",
        "hiddenCaption": "Eu lembro desse dia... Nossa primeira foto juntos S2"
    },
    {
        "date": "2021-02-06",
        "displayDate": "Fevereiro, 2021",
        "image": "./src/img/memorias/2021-02-06_Primeira²-foto-juntos.jpg",
        "caption": "Primeira foto juntos²",
        "hiddenCaption": "Eu lembro desse dia... Primeira foto juntos²"
    },
    {
        "date": "2021-05-26",
        "displayDate": "Maio, 2021",
        "image": "./src/img/memorias/2021-05-26_26.05.2021.jpg",
        "caption": "26.05.2021",
        "hiddenCaption": "Eu lembro desse dia... 26.05.2021"
    },
    {
        "date": "2021-05-29",
        "displayDate": "Maio, 2021",
        "image": "./src/img/memorias/2021-05-29_Uma-das-minhas-fotos-favoritas.jpg",
        "caption": "Uma das minhas fotos favoritas",
        "hiddenCaption": "Eu lembro desse dia... Uma das minhas fotos favoritas"
    },
    {
        "date": "2021-05-30",
        "displayDate": "Maio, 2021",
        "image": "./src/img/memorias/2021-05-30_30.05.2021.jpg",
        "caption": "30.05.2021",
        "hiddenCaption": "Eu lembro desse dia... 30.05.2021"
    },
    {
        "date": "2021-05-30",
        "displayDate": "Maio, 2021",
        "image": "./src/img/memorias/2021-05-30_Cria.jpg",
        "caption": "Cria",
        "hiddenCaption": "Eu lembro desse dia... Cria"
    },
    {
        "date": "2021-06-17",
        "displayDate": "Junho, 2021",
        "image": "./src/img/memorias/2021-06-17_Devolvendo-a-bandana-pro-Axel.jpg",
        "caption": "Devolvendo a bandana pro Axel",
        "hiddenCaption": "Eu lembro desse dia... Devolvendo a bandana pro Axel"
    },
    {
        "date": "2021-06-26",
        "displayDate": "Junho, 2021",
        "image": "./src/img/memorias/2021-06-26_Te-atrapalhando-a-arrumar-o-cabelo-desde-cedo.jpg",
        "caption": "Te atrapalhando a arrumar o cabelo desde cedo",
        "hiddenCaption": "Eu lembro desse dia... Te atrapalhando a arrumar o cabelo desde cedo"
    },
    {
        "date": "2021-06-27",
        "displayDate": "Junho, 2021",
        "image": "./src/img/memorias/2021-06-27_Cosplay-de-Humberto-Carrão.jpg",
        "caption": "Cosplay de Humberto Carrão",
        "hiddenCaption": "Eu lembro desse dia... Cosplay de Humberto Carrão"
    },
    {
        "date": "2021-07-03",
        "displayDate": "Julho, 2021",
        "image": "./src/img/memorias/2021-07-03_Peguei-a-bandana-do-Axel-emprestada.jpg",
        "caption": "Peguei a bandana do Axel emprestada",
        "hiddenCaption": "Eu lembro desse dia... Peguei a bandana do Axel emprestada"
    },
    {
        "date": "2021-07-04",
        "displayDate": "Julho, 2021",
        "image": "./src/img/memorias/2021-07-04_Um-beijinho-pra-você.jpg",
        "caption": "Um beijinho pra você",
        "hiddenCaption": "Eu lembro desse dia... Um beijinho pra você"
    },
    {
        "date": "2021-07-06",
        "displayDate": "Julho, 2021",
        "image": "./src/img/memorias/2021-07-06_06.07.2021.jpg",
        "caption": "06.07.2021",
        "hiddenCaption": "Eu lembro desse dia... 06.07.2021"
    },
    {
        "date": "2021-07-06",
        "displayDate": "Julho, 2021",
        "image": "./src/img/memorias/2021-07-06_Vai-sem-filtro-mesmo.jpg",
        "caption": "Vai sem filtro mesmo",
        "hiddenCaption": "Eu lembro desse dia... Vai sem filtro mesmo"
    },
    {
        "date": "2021-07-09",
        "displayDate": "Julho, 2021",
        "image": "./src/img/memorias/2021-07-09_Segunda-foto-no-shopping.jpg",
        "caption": "Segunda foto no shopping",
        "hiddenCaption": "Eu lembro desse dia... Segunda foto no shopping"
    },
    {
        "date": "2021-07-20",
        "displayDate": "Julho, 2021",
        "image": "./src/img/memorias/2021-07-2021_Indo-comer-canjica-em-alguma-festa-julina.jpg",
        "caption": "21 Indo comer canjica em alguma festa julina",
        "hiddenCaption": "Eu lembro desse dia... 21 Indo comer canjica em alguma festa julina"
    },
    {
        "date": "2021-08-09",
        "displayDate": "Agosto, 2021",
        "image": "./src/img/memorias/2021-08-09_Pra-esquentar-do-frio.jpg",
        "caption": "Pra esquentar do frio",
        "hiddenCaption": "Eu lembro desse dia... Pra esquentar do frio"
    },
    {
        "date": "2021-08-09",
        "displayDate": "Agosto, 2021",
        "image": "./src/img/memorias/2021-08-09_Primeira-foto-no-shopping.jpg",
        "caption": "Primeira foto no shopping",
        "hiddenCaption": "Eu lembro desse dia... Primeira foto no shopping"
    },
    {
        "date": "2021-10-31",
        "displayDate": "Outubro, 2021",
        "image": "./src/img/memorias/2021-10-31_Top-10-melhores-carinhos.jpg",
        "caption": "Top 10 melhores carinhos",
        "hiddenCaption": "Eu lembro desse dia... Top 10 melhores carinhos"
    },
    {
        "date": "2021-12-06",
        "displayDate": "Dezembro, 2021",
        "image": "./src/img/memorias/2021-12-06_06.12.2021.jpg",
        "caption": "06.12.2021",
        "hiddenCaption": "Eu lembro desse dia... 06.12.2021"
    },
    {
        "date": "2022-01-01",
        "displayDate": "Janeiro, 2022",
        "image": "./src/img/memorias/2022-01-01_01.01.2022.jpg",
        "caption": "01.01.2022",
        "hiddenCaption": "Eu lembro desse dia... 01.01.2022"
    },
    {
        "date": "2022-01-01",
        "displayDate": "Janeiro, 2022",
        "image": "./src/img/memorias/2022-01-01_Feliz-ano-novo-com-os-amigos-e-o-Matheus.jpg",
        "caption": "Feliz ano novo com os amigos e o Matheus",
        "hiddenCaption": "Eu lembro desse dia... Feliz ano novo com os amigos e o Matheus"
    },
    {
        "date": "2022-01-02",
        "displayDate": "Janeiro, 2022",
        "image": "./src/img/memorias/2022-01-02_So-pele-e-osso.jpg",
        "caption": "So pele e osso",
        "hiddenCaption": "Eu lembro desse dia... So pele e osso"
    },
    {
        "date": "2022-01-09",
        "displayDate": "Janeiro, 2022",
        "image": "./src/img/memorias/2022-01-09_09.01.2022.jpg",
        "caption": "09.01.2022",
        "hiddenCaption": "Eu lembro desse dia... 09.01.2022"
    },
    {
        "date": "2022-01-09",
        "displayDate": "Janeiro, 2022",
        "image": "./src/img/memorias/2022-01-09_22.02.2023.jpg",
        "caption": "22.02.2023",
        "hiddenCaption": "Eu lembro desse dia... 22.02.2023"
    },
    {
        "date": "2022-01-09",
        "displayDate": "Janeiro, 2022",
        "image": "./src/img/memorias/2022-01-09_Realmente-uma-gata-vai-sem-filtro-mesmo.jpg",
        "caption": "Realmente uma gata vai sem filtro mesmo",
        "hiddenCaption": "Eu lembro desse dia... Realmente uma gata vai sem filtro mesmo"
    },
    {
        "date": "2022-03-15",
        "displayDate": "Março, 2022",
        "image": "./src/img/memorias/2022-03-15_Sorrisinho-mais-lindo-S2.jpg",
        "caption": "Sorrisinho mais lindo S2",
        "hiddenCaption": "Eu lembro desse dia... Sorrisinho mais lindo S2"
    },
    {
        "date": "2022-04-09",
        "displayDate": "Abril, 2022",
        "image": "./src/img/memorias/2022-04-09_09.04.2022.jpg",
        "caption": "09.04.2022",
        "hiddenCaption": "Eu lembro desse dia... 09.04.2022"
    },
    {
        "date": "2022-04-09",
        "displayDate": "Abril, 2022",
        "image": "./src/img/memorias/2022-04-09_Zerando-todos-os-museus-de-Brasília.jpg",
        "caption": "Zerando todos os museus de Brasília",
        "hiddenCaption": "Eu lembro desse dia... Zerando todos os museus de Brasília"
    },
    {
        "date": "2022-04-24",
        "displayDate": "Abril, 2022",
        "image": "./src/img/memorias/2022-04-24_A-blusa-sem-nunca-ter-assistido-um-filme.jpg",
        "caption": "A blusa sem nunca ter assistido um filme",
        "hiddenCaption": "Eu lembro desse dia... A blusa sem nunca ter assistido um filme"
    },
    {
        "date": "2022-04-24",
        "displayDate": "Abril, 2022",
        "image": "./src/img/memorias/2022-04-24_Cria-de-unha-pintada.jpg",
        "caption": "Cria de unha pintada",
        "hiddenCaption": "Eu lembro desse dia... Cria de unha pintada"
    },
    {
        "date": "2022-05-10",
        "displayDate": "Maio, 2022",
        "image": "./src/img/memorias/2022-05-10_No-shops-fazendo-algo.jpg",
        "caption": "No shops fazendo algo",
        "hiddenCaption": "Eu lembro desse dia... No shops fazendo algo"
    },
    {
        "date": "2022-05-21",
        "displayDate": "Maio, 2022",
        "image": "./src/img/memorias/2022-05-21_Casamento-da-minha-tia-Cristina-vai-sem-filtro-mesmo.jpg",
        "caption": "Casamento da minha tia Cristina vai sem filtro mesmo",
        "hiddenCaption": "Eu lembro desse dia... Casamento da minha tia Cristina vai sem filtro mesmo"
    },
    {
        "date": "2022-05-21",
        "displayDate": "Maio, 2022",
        "image": "./src/img/memorias/2022-05-21_Casamento-da-minha-tia-Cristina.jpg",
        "caption": "Casamento da minha tia Cristina",
        "hiddenCaption": "Eu lembro desse dia... Casamento da minha tia Cristina"
    },
    {
        "date": "2022-06-06",
        "displayDate": "Junho, 2022",
        "image": "./src/img/memorias/2022-06-06_06.06.2022.jpg",
        "caption": "06.06.2022",
        "hiddenCaption": "Eu lembro desse dia... 06.06.2022"
    },
    {
        "date": "2022-06-12",
        "displayDate": "Junho, 2022",
        "image": "./src/img/memorias/2022-06-12_Dia-dos-namorados-com-seu-Jota-e-a-esposa.jpg",
        "caption": "Dia dos namorados com seu Jota e a esposa",
        "hiddenCaption": "Eu lembro desse dia... Dia dos namorados com seu Jota e a esposa"
    },
    {
        "date": "2022-06-12",
        "displayDate": "Junho, 2022",
        "image": "./src/img/memorias/2022-06-12_Dia-dos-namorados-com-seu-Jota-no-fundo.jpg",
        "caption": "Dia dos namorados com seu Jota no fundo",
        "hiddenCaption": "Eu lembro desse dia... Dia dos namorados com seu Jota no fundo"
    },
    {
        "date": "2022-06-12",
        "displayDate": "Junho, 2022",
        "image": "./src/img/memorias/2022-06-12_Dia-dos-namorados-na-Torre-de-TV.jpg",
        "caption": "Dia dos namorados na Torre de TV",
        "hiddenCaption": "Eu lembro desse dia... Dia dos namorados na Torre de TV"
    },
    {
        "date": "2022-06-12",
        "displayDate": "Junho, 2022",
        "image": "./src/img/memorias/2022-06-12_Dia-dos-namorados-na-Torre-de-TV².jpg",
        "caption": "Dia dos namorados na Torre de TV²",
        "hiddenCaption": "Eu lembro desse dia... Dia dos namorados na Torre de TV²"
    },
    {
        "date": "2022-06-12",
        "displayDate": "Junho, 2022",
        "image": "./src/img/memorias/2022-06-12_Dia-dos-namorados-no-Museu-Nacional.jpg",
        "caption": "Dia dos namorados no Museu Nacional",
        "hiddenCaption": "Eu lembro desse dia... Dia dos namorados no Museu Nacional"
    },
    {
        "date": "2022-07-23",
        "displayDate": "Julho, 2022",
        "image": "./src/img/memorias/2022-07-23_Voltando-do-Juam.jpg",
        "caption": "Voltando do Juam",
        "hiddenCaption": "Eu lembro desse dia... Voltando do Juam"
    },
    {
        "date": "2022-09-07",
        "displayDate": "Setembro, 2022",
        "image": "./src/img/memorias/2022-09-07_Patriota-no-dia-mais-patriota.jpg",
        "caption": "Patriota no dia mais patriota",
        "hiddenCaption": "Eu lembro desse dia... Patriota no dia mais patriota"
    },
    {
        "date": "2022-09-08",
        "displayDate": "Setembro, 2022",
        "image": "./src/img/memorias/2022-09-08_Independencia-do-Brasil-muito-patriota.jpg",
        "caption": "Independencia do Brasil muito patriota",
        "hiddenCaption": "Eu lembro desse dia... Independencia do Brasil muito patriota"
    },
    {
        "date": "2022-10-09",
        "displayDate": "Outubro, 2022",
        "image": "./src/img/memorias/2022-10-09_Comemorando-22-meses-juntos-S2.jpg",
        "caption": "Comemorando 22 meses juntos S2",
        "hiddenCaption": "Eu lembro desse dia... Comemorando 22 meses juntos S2"
    },
    {
        "date": "2022-10-10",
        "displayDate": "Outubro, 2022",
        "image": "./src/img/memorias/2022-10-10_Visitando-o-congresso.jpg",
        "caption": "Visitando o congresso",
        "hiddenCaption": "Eu lembro desse dia... Visitando o congresso"
    },
    {
        "date": "2022-11-15",
        "displayDate": "Novembro, 2022",
        "image": "./src/img/memorias/2022-11-15_Voltando-do-shopping-com-o-passe-estudantil.jpg",
        "caption": "Voltando do shopping com o passe estudantil",
        "hiddenCaption": "Eu lembro desse dia... Voltando do shopping com o passe estudantil"
    },
    {
        "date": "2022-11-24",
        "displayDate": "Novembro, 2022",
        "image": "./src/img/memorias/2022-11-24_Brasil(2)-X-Servia(0).jpg",
        "caption": "Brasil(2) X Servia(0)",
        "hiddenCaption": "Eu lembro desse dia... Brasil(2) X Servia(0)"
    },
    {
        "date": "2022-12-18",
        "displayDate": "Dezembro, 2022",
        "image": "./src/img/memorias/2022-12-18_Nosso-encontro-romantico-na-roda-gigante.jpg",
        "caption": "Nosso encontro romantico na roda gigante",
        "hiddenCaption": "Eu lembro desse dia... Nosso encontro romantico na roda gigante"
    },
    {
        "date": "2022-12-18",
        "displayDate": "Dezembro, 2022",
        "image": "./src/img/memorias/2022-12-18_Nosso-encontro-romantico-no-carrinho-de-bate-bate.jpg",
        "caption": "Nosso encontro romantico no carrinho de bate bate",
        "hiddenCaption": "Eu lembro desse dia... Nosso encontro romantico no carrinho de bate bate"
    },
    {
        "date": "2022-12-18",
        "displayDate": "Dezembro, 2022",
        "image": "./src/img/memorias/2022-12-18_Sua-primeira-vez-no-nikolandia.jpg",
        "caption": "Sua primeira vez no nikolandia",
        "hiddenCaption": "Eu lembro desse dia... Sua primeira vez no nikolandia"
    },
    {
        "date": "2022-12-24",
        "displayDate": "Dezembro, 2022",
        "image": "./src/img/memorias/2022-12-24_Vespera-do-natal-de-2022.jpg",
        "caption": "Vespera do natal de 2022",
        "hiddenCaption": "Eu lembro desse dia... Vespera do natal de 2022"
    },
    {
        "date": "2022-12-24",
        "displayDate": "Dezembro, 2022",
        "image": "./src/img/memorias/2022-12-24_Vespera-mais-vespera-que-a-outra-vespera.jpg",
        "caption": "Vespera mais vespera que a outra vespera",
        "hiddenCaption": "Eu lembro desse dia... Vespera mais vespera que a outra vespera"
    },
    {
        "date": "2024-06-16",
        "displayDate": "Junho, 2024",
        "image": "./src/img/memorias/2022.07.03_Vai-natral-mesmo.jpg",
        "caption": "Vai natural mesmo",
        "hiddenCaption": "Eu lembro desse dia... Vai natural mesmo"
    },
    {
        "date": "2024-06-16",
        "displayDate": "Junho, 2024",
        "image": "./src/img/memorias/2023-01-01_01.01.2023.jpg",
        "caption": "01.01.2023",
        "hiddenCaption": "Eu lembro desse dia... 01.01.2023"
    },
    {
        "date": "2023-01-01",
        "displayDate": "Janeiro, 2023",
        "image": "./src/img/memorias/2023-01-01_Feliz 2023.jpg",
        "caption": "Feliz 2023",
        "hiddenCaption": "Eu lembro desse dia... Feliz 2023"
    },
    {
        "date": "2023-01-23",
        "displayDate": "Janeiro, 2023",
        "image": "./src/img/memorias/2023-01-23_Adolecentes-no-shops.jpg",
        "caption": "Adolecentes no shops",
        "hiddenCaption": "Eu lembro desse dia... Adolecentes no shops"
    },
    {
        "date": "2023-02-05",
        "displayDate": "Fevereiro, 2023",
        "image": "./src/img/memorias/2023-02-05_Comendo-no-seu-restaurante-fav.jpg",
        "caption": "Comendo no seu restaurante fav",
        "hiddenCaption": "Eu lembro desse dia... Comendo no seu restaurante fav"
    },
    {
        "date": "2023-02-19",
        "displayDate": "Fevereiro, 2023",
        "image": "./src/img/memorias/2023-02-19_A-mochila-cheia-de-contrabando-pro-cinema.jpg",
        "caption": "A mochila cheia de contrabando pro cinema",
        "hiddenCaption": "Eu lembro desse dia... A mochila cheia de contrabando pro cinema"
    },
    {
        "date": "2023-02-19",
        "displayDate": "Fevereiro, 2023",
        "image": "./src/img/memorias/2023-02-19_Algum-filme-que-não-me-lemrbo-o-nome.jpg",
        "caption": "Algum filme que não me lemrbo o nome",
        "hiddenCaption": "Eu lembro desse dia... Algum filme que não me lemrbo o nome"
    },
    {
        "date": "2023-03-07",
        "displayDate": "Março, 2023",
        "image": "./src/img/memorias/2023-03-07_Feliz-seu-dia.jpg",
        "caption": "Feliz seu dia",
        "hiddenCaption": "Eu lembro desse dia... Feliz seu dia"
    },
    {
        "date": "2023-04-23",
        "displayDate": "Abril, 2023",
        "image": "./src/img/memorias/2023-04-23_Café-da-manhã-do-seu-Jota.jpg",
        "caption": "Café da manhã do seu Jota",
        "hiddenCaption": "Eu lembro desse dia... Café da manhã do seu Jota"
    },
    {
        "date": "2023-04-23",
        "displayDate": "Abril, 2023",
        "image": "./src/img/memorias/2023-04-23_Pijama-do-seu-Jota.jpg",
        "caption": "Pijama do seu Jota",
        "hiddenCaption": "Eu lembro desse dia... Pijama do seu Jota"
    },
    {
        "date": "2023-04-30",
        "displayDate": "Abril, 2023",
        "image": "./src/img/memorias/2023-04-30_30.04.2023.jpg",
        "caption": "30.04.2023",
        "hiddenCaption": "Eu lembro desse dia... 30.04.2023"
    },
    {
        "date": "2023-06-03",
        "displayDate": "Junho, 2023",
        "image": "./src/img/memorias/2023-06-03_03.06.2023.jpg",
        "caption": "03.06.2023",
        "hiddenCaption": "Eu lembro desse dia... 03.06.2023"
    },
    {
        "date": "2023-06-26",
        "displayDate": "Junho, 2023",
        "image": "./src/img/memorias/2023-06-26_26.06.2023.jpg",
        "caption": "26.06.2023",
        "hiddenCaption": "Eu lembro desse dia... 26.06.2023"
    },
    {
        "date": "2023-06-26",
        "displayDate": "Junho, 2023",
        "image": "./src/img/memorias/2023-06-26_26.06.2023².jpg",
        "caption": "26.06.2023²",
        "hiddenCaption": "Eu lembro desse dia... 26.06.2023²"
    },
    {
        "date": "2023-08-19",
        "displayDate": "Agosto, 2023",
        "image": "./src/img/memorias/2023-08-19_Aniversario-de-alguém-kkkk.jpg",
        "caption": "Aniversario de alguém kkkk",
        "hiddenCaption": "Eu lembro desse dia... Aniversario de alguém kkkk"
    },
    {
        "date": "2023-10-24",
        "displayDate": "Outubro, 2023",
        "image": "./src/img/memorias/2023-10-24_Aniversário-da-Ana.jpg",
        "caption": "Aniversário da Ana",
        "hiddenCaption": "Eu lembro desse dia... Aniversário da Ana"
    },
    {
        "date": "2023-11-25",
        "displayDate": "Novembro, 2023",
        "image": "./src/img/memorias/2023-11-25_Indo-tirar-um-cochilo.jpg",
        "caption": "Indo tirar um cochilo",
        "hiddenCaption": "Eu lembro desse dia... Indo tirar um cochilo"
    },
    {
        "date": "2023-12-09",
        "displayDate": "Dezembro, 2023",
        "image": "./src/img/memorias/2023-12-09_Nosso_amigo-secreto.jpg",
        "caption": "Nosso amigo secreto",
        "hiddenCaption": "Eu lembro desse dia... Nosso amigo secreto"
    },
    {
        "date": "2023-12-11",
        "displayDate": "Dezembro, 2023",
        "image": "./src/img/memorias/2023-12-11_Uma-das-minhas-fotos-favs².jpg",
        "caption": "Uma das minhas fotos favs²",
        "hiddenCaption": "Eu lembro desse dia... Uma das minhas fotos favs²"
    },
    {
        "date": "2023-12-31",
        "displayDate": "Dezembro, 2023",
        "image": "./src/img/memorias/2023-12-31_Minha-gatinha-linda.jpg",
        "caption": "Minha gatinha linda",
        "hiddenCaption": "Eu lembro desse dia... Minha gatinha linda"
    },
    {
        "date": "2023-12-31",
        "displayDate": "Dezembro, 2023",
        "image": "./src/img/memorias/2023-12-31_S2.jpg",
        "caption": "S2",
        "hiddenCaption": "Eu lembro desse dia... S2"
    },
    {
        "date": "2023-12-10",
        "displayDate": "Dezembro, 2023",
        "image": "./src/img/memorias/2023.12.10_10.12.2023.jpg",
        "caption": "10.12.2023",
        "hiddenCaption": "Eu lembro desse dia... 10.12.2023"
    },
    {
        "date": "2023-12-26",
        "displayDate": "Dezembro, 2023",
        "image": "./src/img/memorias/2023.12.26_meu-presente-de-natal-de-2023.jpg",
        "caption": "meu presente de natal de 2023",
        "hiddenCaption": "Eu lembro desse dia... meu presente de natal de 2023"
    },
    {
        "date": "2024-01-05",
        "displayDate": "Janeiro, 2024",
        "image": "./src/img/memorias/2024-01-05_Nossa-primeira-viagem².jpg",
        "caption": "Nossa primeira viagem²",
        "hiddenCaption": "Eu lembro desse dia... Nossa primeira viagem²"
    },
    {
        "date": "2024-01-05",
        "displayDate": "Janeiro, 2024",
        "image": "./src/img/memorias/2024-01-05_Nossa-primeira-viagem(2).jpg",
        "caption": "Nossa primeira viagem³+²",
        "hiddenCaption": "Eu lembro desse dia... Nossa primeira viagem³+²"
    },
    {
        "date": "2024-01-05",
        "displayDate": "Janeiro, 2024",
        "image": "./src/img/memorias/2024-01-05_Nossa-primeira-viagem(3).jpg",
        "caption": "Nossa primeira viagem³+¹",
        "hiddenCaption": "Eu lembro desse dia... Nossa primeira viagem³+¹"
    },
    {
        "date": "2024-01-05",
        "displayDate": "Janeiro, 2024",
        "image": "./src/img/memorias/2024-01-05_Nossa-primeira-viagem³.jpg",
        "caption": "Nossa primeira viagem³",
        "hiddenCaption": "Eu lembro desse dia... Nossa primeira viagem³"
    },
    {
        "date": "2024-01-05",
        "displayDate": "Janeiro, 2024",
        "image": "./src/img/memorias/2024-01-05_S2.jpg",
        "caption": "S2",
        "hiddenCaption": "Eu lembro desse dia... S2"
    },
    {
        "date": "2024-01-06",
        "displayDate": "Janeiro, 2024",
        "image": "./src/img/memorias/2024-01-06_Não-lemrbo-a-data-e-nem-o-que-a-gente-tava-fazendo-kkkkk.jpg",
        "caption": "Não lemrbo a data e nem o que a gente tava fazendo kkkkk",
        "hiddenCaption": "Eu lembro desse dia... Não lemrbo a data e nem o que a gente tava fazendo kkkkk"
    },
    {
        "date": "2024-02-24",
        "displayDate": "Fevereiro, 2024",
        "image": "./src/img/memorias/2024-02-24_24.02.2024.jpg",
        "caption": "24.02.2024",
        "hiddenCaption": "Eu lembro desse dia... 24.02.2024"
    },
    {
        "date": "2024-03-01",
        "displayDate": "Março, 2024",
        "image": "./src/img/memorias/2024-03-01_Tributo-pra-alguém-no-porks.jpg",
        "caption": "Tributo pra alguém no porks",
        "hiddenCaption": "Eu lembro desse dia... Tributo pra alguém no porks"
    },
    {
        "date": "2024-04-13",
        "displayDate": "Abril, 2024",
        "image": "./src/img/memorias/2024-04-13_Terminando-de-zerar-os-museus-de-Brasília.jpg",
        "caption": "Terminando de zerar os museus de Brasília",
        "hiddenCaption": "Eu lembro desse dia... Terminando de zerar os museus de Brasília"
    },
    {
        "date": "2024-04-13",
        "displayDate": "Abril, 2024",
        "image": "./src/img/memorias/2024-04-13_Terminando-de-zerar-os-museus-de-Brasília².jpg",
        "caption": "Terminando de zerar os museus de Brasília²",
        "hiddenCaption": "Eu lembro desse dia... Terminando de zerar os museus de Brasília²"
    },
    {
        "date": "2024-04-27",
        "displayDate": "Abril, 2024",
        "image": "./src/img/memorias/2024-04-27_30-anos-de-Juam.jpg",
        "caption": "30 anos de Juam",
        "hiddenCaption": "Eu lembro desse dia... 30 anos de Juam"
    },
    {
        "date": "2024-06-09",
        "displayDate": "Junho, 2024",
        "image": "./src/img/memorias/2024-06-09_Aniversário-de-mainha.jpg",
        "caption": "Aniversário de mainha",
        "hiddenCaption": "Eu lembro desse dia... Aniversário de mainha"
    },
    {
        "date": "2024-06-15",
        "displayDate": "Junho, 2024",
        "image": "./src/img/memorias/2024-06-15_Casamento-do-Ronald-e-Alana.jpg",
        "caption": "Casamento do Ronald e Alana",
        "hiddenCaption": "Eu lembro desse dia... Casamento do Ronald e Alana"
    },
    {
        "date": "2024-06-15",
        "displayDate": "Junho, 2024",
        "image": "./src/img/memorias/2024-06-15_Casamento-do-Ronald-e-Alana².jpg",
        "caption": "Casamento do Ronald e Alana²",
        "hiddenCaption": "Eu lembro desse dia... Casamento do Ronald e Alana²"
    },
    {
        "date": "2024-06-16",
        "displayDate": "Junho, 2024",
        "image": "./src/img/memorias/2024-06-16._Indo-de-carro-pro-casamento.jpg",
        "caption": ". Indo de carro pro casamento",
        "hiddenCaption": "Eu lembro desse dia... . Indo de carro pro casamento"
    },
    {
        "date": "2024-11-17",
        "displayDate": "Novembro, 2024",
        "image": "./src/img/memorias/2024-11-17_17.11.2024.jpg",
        "caption": "17.11.2024",
        "hiddenCaption": "Eu lembro desse dia... 17.11.2024"
    },
    {
        "date": "2024-11-24",
        "displayDate": "Novembro, 2024",
        "image": "./src/img/memorias/2024-11-24_aniversario_de_alguém.jpg",
        "caption": "aniversario de alguém",
        "hiddenCaption": "Eu lembro desse dia... aniversario de alguém"
    },
    {
        "date": "2024-11-24",
        "displayDate": "Novembro, 2024",
        "image": "./src/img/memorias/2024-11-24_aniversario_de_alguém².jpg",
        "caption": "aniversario de alguém²",
        "hiddenCaption": "Eu lembro desse dia... aniversario de alguém²"
    },
    {
        "date": "2024-01-05",
        "displayDate": "Janeiro, 2024",
        "image": "./src/img/memorias/2024.01.05_Nossa-primeira-viagem-juntos.jpg",
        "caption": "Nossa primeira viagem juntos",
        "hiddenCaption": "Eu lembro desse dia... Nossa primeira viagem juntos"
    },
    {
        "date": "2024-06-16",
        "displayDate": "Junho, 2024",
        "image": "./src/img/memorias/2024.06.16_16.06.2024.jpg",
        "caption": "16.06.2024",
        "hiddenCaption": "Eu lembro desse dia... 16.06.2024"
    },
    {
        "date": "2024-06-16",
        "displayDate": "Junho, 2024",
        "image": "./src/img/memorias/2024.06.16_Foto-com-a-madrinha-mais-linda-do-casamento.jpg",
        "caption": "Foto com a madrinha mais linda do casamento",
        "hiddenCaption": "Eu lembro desse dia... Foto com a madrinha mais linda do casamento"
    },
    {
        "date": "2024-06-16",
        "displayDate": "Junho, 2024",
        "image": "./src/img/memorias/2024.06.16_Foto-com-a-madrinha-mais-linda-do-casamento².jpg",
        "caption": "2024.06.16 Foto com a madrinha mais linda do casamento²",
        "hiddenCaption": "Eu lembro desse dia... Foto com a madrinha mais linda do casamento²"
    },
    {
        "date": "2024-06-16",
        "displayDate": "Junho, 2024",
        "image": "./src/img/memorias/2024.06.16_Foto-com-o-irmao-da-madrinha-mais-linda-do-casamento.jpg",
        "caption": "2024.06.16 Foto com o irmao da madrinha mais linda do casamento",
        "hiddenCaption": "Eu lembro desse dia... Foto com o irmao da madrinha mais linda do casamento"
    },
    {
        "date": "2024-06-16",
        "displayDate": "Junho, 2024",
        "image": "./src/img/memorias/2024.06.16_Foto-com-os-pais-da-pessoa-que-namora-a-madrinha-mais-linda-do-casamento.jpg",
        "caption": "Foto com os pais da pessoa que namora a madrinha mais linda do casamento",
        "hiddenCaption": "Eu lembro desse dia... Foto com os pais da pessoa que namora a madrinha mais linda do casamento"
    },
    {
        "date": "2024-06-16",
        "displayDate": "Junho, 2024",
        "image": "./src/img/memorias/2024.06.16_Um-Cheiro-no-cangote-da-madrinha-mais-linda-do-casamento.jpg",
        "caption": "Um Cheiro no cangote da madrinha mais linda do casamento",
        "hiddenCaption": "Eu lembro desse dia... Um Cheiro no cangote da madrinha mais linda do casamento"
    },
    {
        "date": "2024-06-16",
        "displayDate": "Junho, 2024",
        "image": "./src/img/memorias/2024.11.04_Coração-pra-alguém-kkkkk.jpg",
        "caption": "Coração pra alguém kkkkk",
        "hiddenCaption": "Eu lembro desse dia... Coração pra alguém kkkkk"
    },
    {
        "date": "2024-06-16",
        "displayDate": "Junho, 2024",
        "image": "./src/img/memorias/2024.12.22_Batizado-do-Bentinho.jpg",
        "caption": "Batizado do Bentinho",
        "hiddenCaption": "Eu lembro desse dia... Batizado do Bentinho"
    },
    {
        "date": "2024-06-16",
        "displayDate": "Junho, 2024",
        "image": "./src/img/memorias/2024.12.26_A-gente-no-natal-de-2024-e-voce-de-franjinha.jpg",
        "caption": "A gente no natal de 2024 e voce de franjinha",
        "hiddenCaption": "Eu lembro desse dia... A gente no natal de 2024 e voce de franjinha"
    },
    {
        "date": "2025-03-02",
        "displayDate": "Março, 2025",
        "image": "./src/img/memorias/2025-03-02_A-gente-com-o-Bentinho-cochilando.jpg",
        "caption": "A gente com o Bentinho cochilando",
        "hiddenCaption": "Eu lembro desse dia... A gente com o Bentinho cochilando"
    },
    {
        "date": "2025-03-09",
        "displayDate": "Março, 2025",
        "image": "./src/img/memorias/2025-03-09_A-gente-na-trilha-super-espontaneos.jpg",
        "caption": "A gente na trilha super espontaneos",
        "hiddenCaption": "Eu lembro desse dia... A gente na trilha super espontaneos"
    },
    {
        "date": "2025-03-09",
        "displayDate": "Março, 2025",
        "image": "./src/img/memorias/2025-03-09_A-gente-na-trilha-super-espontaneos².jpg",
        "caption": "A gente na trilha super espontaneos²",
        "hiddenCaption": "Eu lembro desse dia... A gente na trilha super espontaneos²"
    },
    {
        "date": "2025-03-09",
        "displayDate": "Março, 2025",
        "image": "./src/img/memorias/2025-03-09_A-gente-na-trilha.jpg",
        "caption": "A gente na trilha",
        "hiddenCaption": "Eu lembro desse dia... A gente na trilha"
    },
    {
        "date": "2025-03-09",
        "displayDate": "Março, 2025",
        "image": "./src/img/memorias/2025-03-09_Com-os-amigos-na-trilha.jpg",
        "caption": "Com os amigos na trilha",
        "hiddenCaption": "Eu lembro desse dia... Com os amigos na trilha"
    },
    {
        "date": "2025-04-13",
        "displayDate": "Abril, 2025",
        "image": "./src/img/memorias/2025-04-13_A gente-com-a-Glória.jpg",
        "caption": "A gente com a Glória",
        "hiddenCaption": "Eu lembro desse dia... A gente com a Glória"
    },
    {
        "date": "2025-04-13",
        "displayDate": "Abril, 2025",
        "image": "./src/img/memorias/2025-04-13_A gente-com-um-elefante-sem-nome.jpg",
        "caption": "A gente com um elefante sem nome",
        "hiddenCaption": "Eu lembro desse dia... A gente com um elefante sem nome"
    },
    {
        "date": "2025-04-13",
        "displayDate": "Abril, 2025",
        "image": "./src/img/memorias/2025-04-13_A gente-e-o-Marty-no-fundo.jpg",
        "caption": "A gente e o Marty no fundo",
        "hiddenCaption": "Eu lembro desse dia... A gente e o Marty no fundo"
    },
    {
        "date": "2025-04-13",
        "displayDate": "Abril, 2025",
        "image": "./src/img/memorias/2025-04-13_A gente-na-torre-de-TV-digital.jpg",
        "caption": "A gente na torre de TV digital",
        "hiddenCaption": "Eu lembro desse dia... A gente na torre de TV digital"
    },
    {
        "date": "2025-04-13",
        "displayDate": "Abril, 2025",
        "image": "./src/img/memorias/2025-04-13_A gente-na-torre-de-TV-digital².jpg",
        "caption": "A gente na torre de TV digital²",
        "hiddenCaption": "Eu lembro desse dia... A gente na torre de TV digital²"
    },
    {
        "date": "2025-04-13",
        "displayDate": "Abril, 2025",
        "image": "./src/img/memorias/2025-04-13_Essa-foto-esta-claramente-no-lugar-errado-mas-achei-bonita.jpg",
        "caption": "Essa foto esta claramente no lugar errado mas achei bonita",
        "hiddenCaption": "Eu lembro desse dia... Essa foto esta claramente no lugar errado mas achei bonita"
    },
    {
        "date": "2025-04-21",
        "displayDate": "Abril, 2025",
        "image": "./src/img/memorias/2025-04-21_21.4.2.2025.jpg",
        "caption": "21.04.2025",
        "hiddenCaption": "Eu lembro desse dia... 21.04.2025"
    },
    {
        "date": "2025-04-21",
        "displayDate": "Abril, 2025",
        "image": "./src/img/memorias/2025-04-21_Até-a-Billie-apareceu-e-a-emilie-não.jpg",
        "caption": "Até a Billie apareceu e a emilie não",
        "hiddenCaption": "Eu lembro desse dia... Até a Billie apareceu e a emilie não"
    },
    {
        "date": "2025-04-21",
        "displayDate": "Abril, 2025",
        "image": "./src/img/memorias/2025-04-21_Na-ponte-da-trilha-do-trem.jpg",
        "caption": "Na ponte da trilha do trem",
        "hiddenCaption": "Eu lembro desse dia... Na ponte da trilha do trem"
    },
    {
        "date": "2025-04-21",
        "displayDate": "Abril, 2025",
        "image": "./src/img/memorias/2025-04-21_Na-trilha-do-trem.jpg",
        "caption": "Na trilha do trem",
        "hiddenCaption": "Eu lembro desse dia... Na trilha do trem"
    },
    {
        "date": "2025-04-21",
        "displayDate": "Abril, 2025",
        "image": "./src/img/memorias/2025-04-21_No-mato-da-trilha-do-trem.jpg",
        "caption": "No mato da trilha do trem",
        "hiddenCaption": "Eu lembro desse dia... No mato da trilha do trem"
    },
    {
        "date": "2025-04-21",
        "displayDate": "Abril, 2025",
        "image": "./src/img/memorias/2025-04-21_No-mato-da-trilha-do-trem².jpg",
        "caption": "No mato da trilha do trem²",
        "hiddenCaption": "Eu lembro desse dia... No mato da trilha do trem²"
    },
    {
        "date": "2025-04-21",
        "displayDate": "Abril, 2025",
        "image": "./src/img/memorias/2025-04-21_No-trilho-da-trilha-do-trem.jpg",
        "caption": "No trilho da trilha do trem",
        "hiddenCaption": "Eu lembro desse dia... No trilho da trilha do trem"
    },
    {
        "date": "2025-05-02",
        "displayDate": "Maio, 2025",
        "image": "./src/img/memorias/2025-05-02_02.05.2025.jpg",
        "caption": "02.05.2025",
        "hiddenCaption": "Eu lembro desse dia... 02.05.2025"
    },
    {
        "date": "2025-05-02",
        "displayDate": "Maio, 2025",
        "image": "./src/img/memorias/2025-05-02_Top-10-fotos-preferidas.jpg",
        "caption": "Top 10 fotos preferidas",
        "hiddenCaption": "Eu lembro desse dia... Top 10 fotos preferidas"
    },
    {
        "date": "2025-05-11",
        "displayDate": "Maio, 2025",
        "image": "./src/img/memorias/2025-05-11_Não-lembro-o-pq-estavamos-arrumados-kkkkk.jpg",
        "caption": "Não lembro o pq estavamos arrumados kkkkk",
        "hiddenCaption": "Eu lembro desse dia... Não lembro o pq estavamos arrumados kkkkk"
    },
    {
        "date": "2025-05-25",
        "displayDate": "Maio, 2025",
        "image": "./src/img/memorias/2025-05-25_Minha-gatinha-realizando-um-sonho-S2.jpg",
        "caption": "Minha gatinha realizando um sonho S2",
        "hiddenCaption": "Eu lembro desse dia... Minha gatinha realizando um sonho S2"
    },
    {
        "date": "2025-06-04",
        "displayDate": "Junho, 2025",
        "image": "./src/img/memorias/2025-06-04_A-gente-com-o-bentinho-no-aniversário-da-minha-mãe.jpg",
        "caption": "A gente com o bentinho no aniversário da minha mãe",
        "hiddenCaption": "Eu lembro desse dia... A gente com o bentinho no aniversário da minha mãe"
    },
    {
        "date": "2025-06-14",
        "displayDate": "Junho, 2025",
        "image": "./src/img/memorias/2025-06-14_Pronto-pra-um-cochilo-da-tarde.jpg",
        "caption": "Pronto pra um cochilo da tarde",
        "hiddenCaption": "Eu lembro desse dia... Pronto pra um cochilo da tarde"
    },
    {
        "date": "2025-06-15",
        "displayDate": "Junho, 2025",
        "image": "./src/img/memorias/2025-06-15_Festa-junina-com-o-Bento-muito-puto.jpg",
        "caption": "Festa junina com o Bento muito puto",
        "hiddenCaption": "Eu lembro desse dia... Festa junina com o Bento muito puto"
    },
    {
        "date": "2025-06-15",
        "displayDate": "Junho, 2025",
        "image": "./src/img/memorias/2025-06-15_Festa-junina-com-o-Bento-sem-sorrir-em-uma-foto-achei-foi-paia.jpg",
        "caption": "Festa junina com o Bento sem sorrir em uma foto achei foi paia",
        "hiddenCaption": "Eu lembro desse dia... Festa junina com o Bento sem sorrir em uma foto achei foi paia"
    },
    {
        "date": "2025-06-15",
        "displayDate": "Junho, 2025",
        "image": "./src/img/memorias/2025-06-15_Festa-junina-com-os-amigos.jpg",
        "caption": "Festa junina com os amigos",
        "hiddenCaption": "Eu lembro desse dia... Festa junina com os amigos"
    },
    {
        "date": "2025-06-15",
        "displayDate": "Junho, 2025",
        "image": "./src/img/memorias/2025-06-15_Festa-junina-com-os-amigos².jpg",
        "caption": "Festa junina com os amigos²",
        "hiddenCaption": "Eu lembro desse dia... Festa junina com os amigos²"
    },
    {
        "date": "2025-06-20",
        "displayDate": "Junho, 2025",
        "image": "./src/img/memorias/2025-06-20_Em-algum-tributo-no-porks.jpg",
        "caption": "Em algum tributo no porks",
        "hiddenCaption": "Eu lembro desse dia... Em algum tributo no porks"
    },
    {
        "date": "2025-07-27",
        "displayDate": "Julho, 2025",
        "image": "./src/img/memorias/2025-07-27_A-gente-com-o-Bentolas-sem-sorrir-de-novo.jpg",
        "caption": "A gente com o Bentolas sem sorrir de novo",
        "hiddenCaption": "Eu lembro desse dia... A gente com o Bentolas sem sorrir de novo"
    },
    {
        "date": "2025-08-06",
        "displayDate": "Agosto, 2025",
        "image": "./src/img/memorias/2025-08-06_Aniversário-da-sarah-com-os-amigos.jpg",
        "caption": "Aniversário da sarah com os amigos",
        "hiddenCaption": "Eu lembro desse dia... Aniversário da sarah com os amigos"
    },
    {
        "date": "2025-08-17",
        "displayDate": "Agosto, 2025",
        "image": "./src/img/memorias/2025-08-17_zZZzzzZZzZZzz.jpg",
        "caption": "zZZzzzZZzZZzz",
        "hiddenCaption": "Eu lembro desse dia... zZZzzzZZzZZzz"
    },
    {
        "date": "2025-08-17",
        "displayDate": "Agosto, 2025",
        "image": "./src/img/memorias/2025-08-17_zZZzzzZZzZZZzzZZz.jpg",
        "caption": "zZZzzzZZzZZZzzZZz",
        "hiddenCaption": "Eu lembro desse dia... zZZzzzZZzZZZzzZZz"
    },
    {
        "date": "2025-08-17",
        "displayDate": "Agosto, 2025",
        "image": "./src/img/memorias/2025-08-17_zZZzzzZZzZZZzzZZzz.jpg",
        "caption": "zZZzzzZZzZZZzzZZzz",
        "hiddenCaption": "Eu lembro desse dia... zZZzzzZZzZZZzzZZzz"
    },
    {
        "date": "2025-08-23",
        "displayDate": "Agosto, 2025",
        "image": "./src/img/memorias/2025-08-23_Bento-é-inimigo-do-riso.jpg",
        "caption": "Bento é inimigo do riso",
        "hiddenCaption": "Eu lembro desse dia... Bento é inimigo do riso"
    },
    {
        "date": "2025-08-23",
        "displayDate": "Agosto, 2025",
        "image": "./src/img/memorias/2025-08-23_Bento-é-inimigo-do-riso².jpg",
        "caption": "Bento é inimigo do riso²",
        "hiddenCaption": "Eu lembro desse dia... Bento é inimigo do riso²"
    },
    {
        "date": "2025-08-23",
        "displayDate": "Agosto, 2025",
        "image": "./src/img/memorias/2025-08-23_Festa-Algustina-no-Juam.jpg",
        "caption": "Festa Algustina no Juam",
        "hiddenCaption": "Eu lembro desse dia... Festa Algustina no Juam"
    },
    {
        "date": "2025-08-23",
        "displayDate": "Agosto, 2025",
        "image": "./src/img/memorias/2025-08-23_Festa-Algustina-no-Juam².jpg",
        "caption": "Festa Algustina no Juam²",
        "hiddenCaption": "Eu lembro desse dia... Festa Algustina no Juam²"
    },
    {
        "date": "2025-08-23",
        "displayDate": "Agosto, 2025",
        "image": "./src/img/memorias/2025-08-23_Festa-Algustina-no-Juam³.jpg",
        "caption": "Festa Algustina no Juam³",
        "hiddenCaption": "Eu lembro desse dia... Festa Algustina no Juam³"
    },
    {
        "date": "2025-09-09",
        "displayDate": "Setembro, 2025",
        "image": "./src/img/memorias/2025-09-09_Real-primeira-foto-do-casal-kkkkkkkkkkkkkk-(a-data-ta-claramente-errada).jpg",
        "caption": "Real primeira foto do casal kkkkkkkkkkkkkk (a data ta claramente errada)",
        "hiddenCaption": "Eu lembro desse dia... Real primeira foto do casal kkkkkkkkkkkkkk (a data ta claramente errada)"
    },
    {
        "date": "2025-09-13",
        "displayDate": "Setembro, 2025",
        "image": "./src/img/memorias/2025-09-13_Você-sendo-convidada-pra-ser-a-noiva-mais-linda-do-casamento-de-novo.jpg",
        "caption": "Você sendo convidada pra ser a noiva mais linda do casamento de novo",
        "hiddenCaption": "Eu lembro desse dia... Você sendo convidada pra ser a noiva mais linda do casamento de novo"
    },
    {
        "date": "2025-10-04",
        "displayDate": "Outubro, 2025",
        "image": "./src/img/memorias/2025-10-04_Provando-o-picole-do-amigo.jpg",
        "caption": "Provando o picole do amigo",
        "hiddenCaption": "Eu lembro desse dia... Provando o picole do amigo"
    },
    {
        "date": "2025-10-05",
        "displayDate": "Outubro, 2025",
        "image": "./src/img/memorias/2025-10-05_Aniversário-do-Bento-com-o-aniversariante.jpg",
        "caption": "Aniversário do Bento com o aniversariante",
        "hiddenCaption": "Eu lembro desse dia... Aniversário do Bento com o aniversariante"
    },
    {
        "date": "2025-10-05",
        "displayDate": "Outubro, 2025",
        "image": "./src/img/memorias/2025-10-05_Aniversário-do-Bento-com-o-aniversáriante-e-com-a-tia-menos-preferida.jpg",
        "caption": "Aniversário do Bento com o aniversáriante e com a tia menos preferida",
        "hiddenCaption": "Eu lembro desse dia... Aniversário do Bento com o aniversáriante e com a tia menos preferida"
    },
    {
        "date": "2025-10-05",
        "displayDate": "Outubro, 2025",
        "image": "./src/img/memorias/2025-10-05_Aniversário-do-Bento-com-o-aniversáriante-e-com-os-tios-menos-preferidos.jpg",
        "caption": "Aniversário do Bento com o aniversáriante e com os tios menos preferidos",
        "hiddenCaption": "Eu lembro desse dia... Aniversário do Bento com o aniversáriante e com os tios menos preferidos"
    },
    {
        "date": "2025-10-05",
        "displayDate": "Outubro, 2025",
        "image": "./src/img/memorias/2025-10-05_Aniversário-do-Bento-com-o-aniversáriante².jpg",
        "caption": "Aniversário do Bento com o aniversáriante²",
        "hiddenCaption": "Eu lembro desse dia... Aniversário do Bento com o aniversáriante²"
    },
    {
        "date": "2025-10-05",
        "displayDate": "Outubro, 2025",
        "image": "./src/img/memorias/2025-10-05_Aniversário-do-Bento-com-o-aniversáriante³.jpg",
        "caption": "Aniversário do Bento com o aniversáriante³",
        "hiddenCaption": "Eu lembro desse dia... Aniversário do Bento com o aniversáriante³"
    },
    {
        "date": "2025-10-24",
        "displayDate": "Outubro, 2025",
        "image": "./src/img/memorias/2025-10-24_Eu-e-minha-gatinha.jpg",
        "caption": "Eu e minha gatinha",
        "hiddenCaption": "Eu lembro desse dia... Eu e minha gatinha"
    },
    {
        "date": "2025-10-24",
        "displayDate": "Outubro, 2025",
        "image": "./src/img/memorias/2025-10-24_Nossa-segunda-viagem-(ignora-o-menino-feio-na-foto).jpg",
        "caption": "Nossa segunda viagem (ignora o menino feio na foto)",
        "hiddenCaption": "Eu lembro desse dia... Nossa segunda viagem (ignora o menino feio na foto)"
    },
    {
        "date": "2025-10-24",
        "displayDate": "Outubro, 2025",
        "image": "./src/img/memorias/2025-10-24_Queria-viver-esse-dia-de-novo.jpg",
        "caption": "Queria viver esse dia de novo",
        "hiddenCaption": "Eu lembro desse dia... Queria viver esse dia de novo"
    },
    {
        "date": "2025-10-25",
        "displayDate": "Outubro, 2025",
        "image": "./src/img/memorias/2025-10-25_25.10.2025.jpg",
        "caption": "25.10.2025",
        "hiddenCaption": "Eu lembro desse dia... 25.10.2025"
    },
    {
        "date": "2025-10-25",
        "displayDate": "Outubro, 2025",
        "image": "./src/img/memorias/2025-10-25_25.10.2025².jpg",
        "caption": "25.10.2025²",
        "hiddenCaption": "Eu lembro desse dia... 25.10.2025²"
    },
    {
        "date": "2025-10-25",
        "displayDate": "Outubro, 2025",
        "image": "./src/img/memorias/2025-10-25_Ainda-bem-que-essa-gatinha-é-toda-minha.jpg",
        "caption": "Ainda bem que essa gatinha é toda minha",
        "hiddenCaption": "Eu lembro desse dia... Ainda bem que essa gatinha é toda minha"
    },
    {
        "date": "2025-10-25",
        "displayDate": "Outubro, 2025",
        "image": "./src/img/memorias/2025-10-25_Como-faz-pra-vivcer-esses-dias-de-novo.jpg",
        "caption": "Como faz pra vivcer esses dias de novo",
        "hiddenCaption": "Eu lembro desse dia... Como faz pra vivcer esses dias de novo"
    },
    {
        "date": "2025-10-25",
        "displayDate": "Outubro, 2025",
        "image": "./src/img/memorias/2025-10-25_Nossos-filhos-vão-ver-essa-e-falar-“nossa-papai-o-titio-era-muito-feio”.jpg",
        "caption": "Nossos filhos vão ver essa e falar “nossa papai o titio era muito feio”",
        "hiddenCaption": "Eu lembro desse dia... Nossos filhos vão ver essa e falar “nossa papai o titio era muito feio”"
    },
    {
        "date": "2025-10-25",
        "displayDate": "Outubro, 2025",
        "image": "./src/img/memorias/2025-10-25_Vou-mostrar-essas-pros-nossos-filhos-e-te-perguntar-se-a-gente-ainda-namorava-essa-época.jpg",
        "caption": "Vou mostrar essas pros nossos filhos e te perguntar se a gente ainda namorava essa época",
        "hiddenCaption": "Eu lembro desse dia... Vou mostrar essas pros nossos filhos e te perguntar se a gente ainda namorava essa época"
    },
    {
        "date": "2025-10-26",
        "displayDate": "Outubro, 2025",
        "image": "./src/img/memorias/2025-10-26_26.10.2025.jpg",
        "caption": "26.10.2025",
        "hiddenCaption": "Eu lembro desse dia... 26.10.2025"
    },
    {
        "date": "2025-10-26",
        "displayDate": "Outubro, 2025",
        "image": "./src/img/memorias/2025-10-26_26.10.2025².jpg",
        "caption": "26.10.2025²",
        "hiddenCaption": "Eu lembro desse dia... 26.10.2025²"
    },
    {
        "date": "2025-10-26",
        "displayDate": "Outubro, 2025",
        "image": "./src/img/memorias/2025-10-26_26.10.2025³.jpg",
        "caption": "26.10.2025³",
        "hiddenCaption": "Eu lembro desse dia... 26.10.2025³"
    },
    {
        "date": "2025-10-26",
        "displayDate": "Outubro, 2025",
        "image": "./src/img/memorias/2025-10-26_Minhas-ideias-para-legendas-estão-acabando-mas-o-que-importa-é-que-voce-é-linda.jpg",
        "caption": "Minhas ideias para legendas estão acabando mas o que importa é que voce é linda",
        "hiddenCaption": "Eu lembro desse dia... Minhas ideias para legendas estão acabando mas o que importa é que voce é linda"
    },
    {
        "date": "2025-10-26",
        "displayDate": "Outubro, 2025",
        "image": "./src/img/memorias/2025-10-26_Olha-que-sorrisinho-lindo.jpg",
        "caption": "Olha que sorrisinho lindo",
        "hiddenCaption": "Eu lembro desse dia... Olha que sorrisinho lindo"
    },
    {
        "date": "2025-10-29",
        "displayDate": "Outubro, 2025",
        "image": "./src/img/memorias/2025-10-29_Show-do-imagine-dragons-com-a-minha-gatinha.jpg",
        "caption": "Show do imagine dragons com a minha gatinha",
        "hiddenCaption": "Eu lembro desse dia... Show do imagine dragons com a minha gatinha"
    },
    {
        "date": "2025-10-29",
        "displayDate": "Outubro, 2025",
        "image": "./src/img/memorias/2025-10-29_Show-do-imagine-dragons-com-a-minha-gatinha².jpg",
        "caption": "Show do imagine dragons com a minha gatinha²",
        "hiddenCaption": "Eu lembro desse dia... Show do imagine dragons com a minha gatinha²"
    },
    {
        "date": "2025-10-30",
        "displayDate": "Outubro, 2025",
        "image": "./src/img/memorias/2025-10-30_Depois-do-show-do-imagine-dragons-com-a-minha-gatinha-e-os-amigos-amassando-um-hamburgão.jpg",
        "caption": "Depois do show do imagine dragons com a minha gatinha e os amigos amassando um hamburgão",
        "hiddenCaption": "Eu lembro desse dia... Depois do show do imagine dragons com a minha gatinha e os amigos amassando um hamburgão"
    },
    {
        "date": "2025-10-30",
        "displayDate": "Outubro, 2025",
        "image": "./src/img/memorias/2025-10-30_Saindo-do-show-do-imagine-dragons-com-a-minha-gatinha-e-os-amigos.jpg",
        "caption": "Saindo do show do imagine dragons com a minha gatinha e os amigos",
        "hiddenCaption": "Eu lembro desse dia... Saindo do show do imagine dragons com a minha gatinha e os amigos"
    },
    {
        "date": "2025-10-30",
        "displayDate": "Outubro, 2025",
        "image": "./src/img/memorias/2025-10-30_Show-do-imagine-dragons-com-a-minha-gatinha-e-os-amigos.jpg",
        "caption": "Show do imagine dragons com a minha gatinha e os amigos",
        "hiddenCaption": "Eu lembro desse dia... Show do imagine dragons com a minha gatinha e os amigos"
    },
    {
        "date": "2025-12-07",
        "displayDate": "Dezembro, 2025",
        "image": "./src/img/memorias/2025-12-07_07.12.2025.jpg",
        "caption": "07.12.2025",
        "hiddenCaption": "Eu lembro desse dia... 07.12.2025"
    },
    {
        "date": "2025-12-13",
        "displayDate": "Dezembro, 2025",
        "image": "./src/img/memorias/2025-12-13-A-Tainá-pouco-feliz.jpg",
        "caption": "A Tainá pouco feliz",
        "hiddenCaption": "Eu lembro desse dia... A Tainá pouco feliz"
    },
    {
        "date": "2025-12-13",
        "displayDate": "Dezembro, 2025",
        "image": "./src/img/memorias/2025-12-13-Eu-e-você-com-os-noivos.jpg",
        "caption": "Eu e você com os noivos",
        "hiddenCaption": "Eu lembro desse dia... Eu e você com os noivos"
    },
    {
        "date": "2025-12-13",
        "displayDate": "Dezembro, 2025",
        "image": "./src/img/memorias/2025-12-13_Atrapalhando-meu-amo-a-se-arrumar-pro-casamento.jpg",
        "caption": "Atrapalhando meu amo a se arrumar pro casamento",
        "hiddenCaption": "Eu lembro desse dia... Atrapalhando meu amo a se arrumar pro casamento"
    },
    {
        "date": "2025-12-13",
        "displayDate": "Dezembro, 2025",
        "image": "./src/img/memorias/2025-12-13_Atrapalhando-meu-amo-a-se-arrumar-pro-casamento².jpg",
        "caption": "Atrapalhando meu amo a se arrumar pro casamento²",
        "hiddenCaption": "Eu lembro desse dia... Atrapalhando meu amo a se arrumar pro casamento²"
    },
    {
        "date": "2025-12-13",
        "displayDate": "Dezembro, 2025",
        "image": "./src/img/memorias/2025-12-13_Eu-e-você-de-novo-pq-a-gente-forma-um-ótimo-casal.jpg",
        "caption": "Eu e você de novo pq a gente forma um ótimo casal",
        "hiddenCaption": "Eu lembro desse dia... Eu e você de novo pq a gente forma um ótimo casal"
    },
    {
        "date": "2025-12-13",
        "displayDate": "Dezembro, 2025",
        "image": "./src/img/memorias/2025-12-13_Eu-e-você-esperando-a-hora-de-comer.jpg",
        "caption": "Eu e você esperando a hora de comer",
        "hiddenCaption": "Eu lembro desse dia... Eu e você esperando a hora de comer"
    },
    {
        "date": "2025-12-13",
        "displayDate": "Dezembro, 2025",
        "image": "./src/img/memorias/2025-12-13_Todo-mundo-com-os-noivos.jpg",
        "caption": "Todo mundo com os noivos",
        "hiddenCaption": "Eu lembro desse dia... Todo mundo com os noivos"
    },
    {
        "date": "2025-12-14",
        "displayDate": "Dezembro, 2025",
        "image": "./src/img/memorias/2025-12-14_After-do-casamento-mas-sem-os-casados-e-o-bento-tirando-meleca-do-nariz.jpg",
        "caption": "After do casamento mas sem os casados e o bento tirando meleca do nariz",
        "hiddenCaption": "Eu lembro desse dia... After do casamento mas sem os casados e o bento tirando meleca do nariz"
    },
    {
        "date": "2025-12-14",
        "displayDate": "Dezembro, 2025",
        "image": "./src/img/memorias/2025-12-14_After-do-casamento-mas-sem-os-casados.jpg",
        "caption": "After do casamento mas sem os casados",
        "hiddenCaption": "Eu lembro desse dia... After do casamento mas sem os casados"
    },
    {
        "date": "2025-12-18",
        "displayDate": "Dezembro, 2025",
        "image": "./src/img/memorias/2025-12-18_Esse-mlk-é-tão-feio-que-nem-parece-meu-irmão.jpg",
        "caption": "Esse mlk é tão feio que nem parece meu irmão",
        "hiddenCaption": "Eu lembro desse dia... Esse mlk é tão feio que nem parece meu irmão"
    },
    {
        "date": "2025-12-18",
        "displayDate": "Dezembro, 2025",
        "image": "./src/img/memorias/2025-12-18_Esse-mlk-é-tão-feio-que-nem-parece-meu-irmão².jpg",
        "caption": "Esse mlk é tão feio que nem parece meu irmão²",
        "hiddenCaption": "Eu lembro desse dia... Esse mlk é tão feio que nem parece meu irmão²"
    },
    {
        "date": "2025-12-18",
        "displayDate": "Dezembro, 2025",
        "image": "./src/img/memorias/2025-12-18_Esse-mlk-é-tão-feio-que-nem-parece-meu-irmão³.jpg",
        "caption": "Esse mlk é tão feio que nem parece meu irmão³",
        "hiddenCaption": "Eu lembro desse dia... Esse mlk é tão feio que nem parece meu irmão³"
    },
    {
        "date": "2025-12-19",
        "displayDate": "Dezembro, 2025",
        "image": "./src/img/memorias/2025-12-19_Aniversário-do-menino-mais-feio-do-mundo.jpg",
        "caption": "Aniversário do menino mais feio do mundo",
        "hiddenCaption": "Eu lembro desse dia... Aniversário do menino mais feio do mundo"
    },
    {
        "date": "2025-12-19",
        "displayDate": "Dezembro, 2025",
        "image": "./src/img/memorias/2025-12-19_Uma-beijoquinha-do-meu-amor.jpg",
        "caption": "Uma beijoquinha do meu amor",
        "hiddenCaption": "Eu lembro desse dia... Uma beijoquinha do meu amor"
    }
];
